{
  "warehouse_id": "WDL",
  "shelves": [
    {
      "shelf_id": "WDL-06-RG-02",
      "bins": [
        { "bin_id": "WDL-06-RG-02-F-01", "pixels": [0, 1, 2, 3] },
        { "bin_id": "WDL-06-RG-02-F-02", "pixels": [5, 6, 7, 8] },
        { "bin_id": "WDL-06-RG-02-F-03", "pixels": [10, 11, 12, 13] },
        { "bin_id": "WDL-06-RG-02-F-04", "pixels": [15, 16, 17, 18] },
        { "bin_id": "WDL-06-RG-02-F-05", "pixels": [20, 21, 22, 23] }
      ]
    }
  ],
  "led_strip": {
    "length": 600,
    "data_pin": 5,
    "chipset": "SK6812_GRBW"
  },
  "defaults": {
    "color": "#00FF00",
    "pattern": "solid",
    "intensity": 200,
    "speed": 1200
  }
}
